type,text,platform,wait_sec,thread,next_thread,terminal,option_a_text,option_a_thread,option_b_text,option_b_thread
self,Hello Jessica- nice to meet you!,tinder,0,a,,,,,,
self,How is your week going so far?,tinder,2,a,,,,,,
girl,Nice to meet you too,tinder,4,a,,,,,,
girl,So far so good. And with you?,tinder,2,a,,,,,,
self,"Pretty great. This weather has been amazing, so I got some time outdoors today.",tinder,2,a,,,,,,
narrator,Nice job keeping it positive. People are generally attracted to positive energy.,tinder,1,a,,,,,,
branch,Where should we take this conversation?,tinder,0,a,,,Figure out why she is on a dating app,b,Learn more about her,c
self,Have you met any cool people on this app yet?,tinder,0,b,,,,,,
girl,"Hahaha, I've met a few people",tinder,10,b,,,,,,
girl,"But honestly, I mostly use it for entertainment",tinder,2,b,,,,,,
girl,When I'm bored lol,tinder,2,b,,,,,,
girl,How about you?,tinder,2,b,,,,,,
self,"Yeah, I've met some great women on this app",tinder,2,b,,,,,,
self,"I think meeting new people is one of the best parts of life, so overall I think dating apps are net positive",tinder,2,b,,,,,,
narrator,That's what I'm talking about with positive vibes. Nice work. Let's see how she responds,tinder,1,b,,,,,,
girl,I totally agree :),tinder,10,b,,,,,,
branch,,tinder,0,b,d,,,,,
self,What do you do for work? :),tinder,0,c,,,,,,
girl,I work as a clinical assistant for a chronic pain clinic and functional rehab center,tinder,8,c,,,,,,
girl,What do you do?,tinder,2,c,,,,,,
self,Wow. That sounds like a really cool job. How long have you been in healthcare for?,tinder,2,c,,,,,,
self,I'm a software engineer,tinder,2,c,,,,,,
girl,I actually just graduated a year ago. I was an EMT for a little bit and then in this job since then.,tinder,10,c,,,,,,
girl,That's cool. Did you study engineering in school?,tinder,2,c,,,,,,
self,"I did, but honestly I learned more outside of school than in school.",tinder,2,c,,,,,,
narrator,It's nice to get to know people. But conversation like this can get really dry talking through an app. Perhaps try another topic?,tinder,1,c,,,,,,
branch,,tinder,0,c,d,,,,,
branch,,tinder,0,d,,,Move toward asking her out,e,Ask about her interests and hobbies,f
self,So what are some of your favorite date activities?,tinder,0,e,,,,,,
girl,Hahaha,tinder,10,e,,,,,,
girl,Hmmmm. I like going out to eat. I think most people do haha,tinder,4,e,,,,,,
girl,How about you?,tinder,2,e,,,,,,
self,"I like going out to eat as well :) I also like going on hikes, and checking out museums and art shows.",tinder,2,e,,,,,,
branch,,tinder,0,e,g,,,,,
self,So what do you like to do when you're not working?,tinder,0,f,,,,,,
narrator,"Sorry to say, this is where the conversation ends. Next time try asking some questions that are a little more interesting or unexpected.",tinder,1,f,,,,,,
branch,,tinder,0,f,,TRUE,,,,
branch,,tinder,0,g,,,Ask her out to dinner,h,Ask her to at an event,i
self,So would you like to go out to dinner sometime?,tinder,0,h,,,,,,
narrator,"Sometimes people just don't respond. It's nothing personal. Keep on moving, and maintain a positive attitude.",tinder,14400,h,,,,,,
branch,,tinder,0,h,,TRUE,,,,
self,"There's this weekly event at the academy of sciences called nightlife, have you heard of it?",tinder,0,i,,,,,,
girl,I have not. What is it?,tinder,10,i,,,,,,
self,"Basically the academy of sciences has all of these cool exhibits and an aquarium, and they do an after hours event on Thursday nights with music and drinks.",tinder,2,i,,,,,,
self,It's a pretty fun time,tinder,2,i,,,,,,
girl,It sounds really neat :),tinder,8,i,,,,,,
self,Would you be open to going this Thursday? Maybe we can get something to eat before or after?,tinder,2,i,,,,,,
girl,"Yeah, that sounds like fun :)",tinder,4,i,,,,,,
self,great!,tinder,2,i,,,,,,
self,Want to coordinate over text? My number is 555.555.5555.,tinder,2,i,,,,,,
girl,Sure,tinder,8,i,,,,,,
girl,My number is 555.555.5555,tinder,2,i,,,,,,
narrator,"Sounds like a super fun event, great move offering a unqiue date idea.",tinder,0,i,,,,,,
branch,,tinder,0,i,j,,,,,
self,Hello there :) This is Colin,iMessage,0,j,,,,,,
girl,Hey Colin :),iMessage,2,j,,,,,,
self,How's your evening going?,iMessage,0,j,,,,,,
girl,"Pretty well, just at home cooking dinner",iMessage,2,j,,,,,,
self,Nice! What are you cooking?,iMessage,0,j,,,,,,
girl,Pasta and salad ,iMessage,2,j,,,,,,
girl,What are you up to?,iMessage,2,j,,,,,,
self,Was about to head to the gym actually,iMessage,0,j,,,,,,
narrator,Sublte information that displays that you're heathly and well rounded can go a long way.,iMessage,1,j,,,,,,
girl,Nice :),iMessage,2,j,,,,,,
self,"So for this Thursday, the event goes from 6-10. When is a good time for you?",iMessage,0,j,,,,,,
girl,Hmmmm,iMessage,2,j,,,,,,
girl,I think 7 or 8 would be best,iMessage,1,j,,,,,,
self,Either works for me. Should we say 7:30?,iMessage,0,j,,,,,,
self,"Also, would you like me to pick you up, or would you like to meet there?",iMessage,0,j,,,,,,
narrator,"Good move. Sometimes women don't like the idea of a stranger picking them up. It's always nice to offer, but make it an option.",iMessage,1,j,,,,,,
girl,You can pick me up at my place at 7:30.,iMessage,2,j,,,,,,
girl,My address is 1223 Potrero,iMessage,1,j,,,,,,
self,Great! See you Thursday at 7:30,iMessage,0,j,,,,,,
branch,,,,j,k,,,,,
branch,Your date is coming up tomorrow.,iMessage,0,k,,,Send a text to check in.,l,Wait until tomorrow.,m
self,Hey Jessica! Still on for tomorrow night?,iMessage,0,l,,,,,,
girl,Yessir :),iMessage,2,l,,,,,,
self,Great! I'll see you at 7:30. Looking forward to it.,iMessage,0,l,,,,,,
girl,Me too :),iMessage,1,l,,,,,,
branch,,iMessage,0,l,n,,,,,
self,Hey Jessica! Still on for tonight?,iMessage,0,m,,,,,,
girl,Hey there,iMessage,2,m,,,,,,
girl,Yep. 7:30?,iMessage,1,m,,,,,,
self,Yeah! Looking forward to it.,iMessage,0,m,,,,,,
girl,Me too :),iMessage,1,m,,,,,,
branch,,iMessage,0,m,n,,,,,
self,Thanks for meeting up with me tonight Jessica!,iMessage,0,n,,,,,,
girl,Thank you for dinner :),iMessage,2,n,,,,,,
self,You're welcome :),iMessage,0,n,,,,,,
self,I hope you have a good night,iMessage,0,n,,,,,,
girl,You too,iMessage,2,n,,,,,,
narrator,"Okay okay. Seems like you had a decent date. Wait a couple days, and follow up to see how she is and ask her out again.",iMessage,0,n,,,,,,
branch,,iMessage,0,n,,TRUE,,,,